{
  "schema_version": 1,
  "sources": [
    "fixture-object-ids"
  ],
  "confidence": "observed",
  "description": "Observed serialized IDs; membership does not assert property support.",
  "object_ids": [
    1,
    2,
    3,
    4,
    5,
    6,
    7,
    8,
    9,
    10,
    11,
    12,
    13,
    15,
    16,
    17,
    18,
    19,
    20,
    21,
    22,
    23,
    24,
    25,
    26,
    27,
    28,
    29,
    30,
    31,
    32,
    33,
    34,
    35,
    36,
    39,
    40,
    41,
    45,
    46,
    47,
    48,
    49,
    50,
    51,
    52,
    53,
    54,
    55,
    56,
    57,
    58,
    59,
    60,
    61,
    62,
    63,
    64,
    65,
    66,
    67,
    68,
    69,
    70,
    71,
    72,
    73,
    74,
    75,
    76,
    77,
    78,
    80,
    81,
    82,
    83,
    84,
    85,
    86,
    87,
    88,
    89,
    90,
    91,
    92,
    93,
    94,
    95,
    96,
    97,
    98,
    99,
    101,
    103,
    105,
    106,
    107,
    110,
    111,
    113,
    114,
    115,
    116,
    117,
    118,
    119,
    120,
    121,
    122,
    123,
    124,
    125,
    126,
    127,
    128,
    129,
    130,
    131,
    132,
    133,
    134,
    135,
    136,
    137,
    138,
    139,
    140,
    141,
    143,
    144,
    145,
    146,
    147,
    148,
    149,
    150,
    151,
    152,
    153,
    154,
    155,
    156,
    157,
    158,
    159,
    160,
    161,
    162,
    163,
    164,
    165,
    166,
    167,
    168,
    169,
    170,
    171,
    172,
    173,
    174,
    175,
    176,
    177,
    178,
    179,
    180,
    181,
    182,
    183,
    184,
    185,
    186,
    187,
    188,
    190,
    191,
    192,
    193,
    194,
    195,
    196,
    197,
    198,
    199,
    200,
    201,
    202,
    203,
    204,
    205,
    206,
    207,
    208,
    209,
    210,
    211,
    212,
    213,
    215,
    216,
    217,
    218,
    219,
    220,
    222,
    223,
    224,
    225,
    226,
    227,
    228,
    229,
    230,
    231,
    232,
    233,
    234,
    235,
    236,
    237,
    238,
    239,
    240,
    241,
    242,
    243,
    244,
    245,
    246,
    247,
    248,
    249,
    250,
    251,
    252,
    253,
    254,
    255,
    256,
    257,
    258,
    259,
    260,
    261,
    263,
    264,
    265,
    266,
    267,
    268,
    269,
    270,
    271,
    272,
    273,
    274,
    275,
    277,
    278,
    279,
    280,
    281,
    282,
    283,
    284,
    285,
    286,
    287,
    289,
    291,
    294,
    295,
    296,
    297,
    299,
    301,
    305,
    307,
    309,
    311,
    315,
    317,
    321,
    323,
    324,
    325,
    326,
    327,
    328,
    329,
    331,
    333,
    337,
    339,
    343,
    345,
    349,
    351,
    353,
    355,
    358,
    363,
    364,
    365,
    366,
    367,
    368,
    369,
    370,
    371,
    372,
    373,
    374,
    375,
    376,
    377,
    378,
    392,
    393,
    394,
    395,
    396,
    397,
    398,
    399,
    405,
    406,
    407,
    408,
    409,
    410,
    411,
    412,
    413,
    414,
    419,
    420,
    421,
    422,
    446,
    447,
    448,
    449,
    450,
    451,
    452,
    453,
    454,
    455,
    456,
    457,
    458,
    459,
    460,
    461,
    462,
    463,
    464,
    465,
    466,
    467,
    468,
    469,
    470,
    471,
    472,
    473,
    474,
    475,
    476,
    477,
    478,
    479,
    480,
    481,
    482,
    483,
    484,
    485,
    486,
    487,
    488,
    489,
    490,
    491,
    492,
    493,
    494,
    495,
    496,
    497,
    498,
    499,
    500,
    501,
    502,
    503,
    504,
    505,
    506,
    507,
    508,
    509,
    510,
    511,
    512,
    513,
    514,
    515,
    516,
    517,
    518,
    519,
    520,
    521,
    522,
    523,
    524,
    525,
    526,
    527,
    528,
    529,
    530,
    531,
    532,
    533,
    534,
    535,
    536,
    537,
    538,
    539,
    540,
    541,
    542,
    543,
    544,
    545,
    546,
    547,
    548,
    549,
    550,
    551,
    552,
    553,
    554,
    555,
    556,
    557,
    558,
    559,
    560,
    561,
    562,
    563,
    564,
    565,
    566,
    567,
    568,
    569,
    570,
    571,
    572,
    573,
    574,
    575,
    576,
    577,
    578,
    579,
    580,
    581,
    582,
    583,
    584,
    585,
    586,
    587,
    588,
    589,
    590,
    591,
    592,
    593,
    594,
    595,
    596,
    597,
    598,
    599,
    600,
    601,
    602,
    603,
    604,
    605,
    606,
    607,
    608,
    609,
    610,
    611,
    612,
    613,
    614,
    615,
    616,
    617,
    618,
    619,
    620,
    621,
    622,
    623,
    624,
    625,
    626,
    627,
    628,
    629,
    630,
    631,
    632,
    633,
    634,
    635,
    636,
    637,
    638,
    639,
    640,
    641,
    642,
    643,
    644,
    645,
    646,
    647,
    648,
    649,
    650,
    651,
    652,
    653,
    654,
    655,
    656,
    657,
    658,
    659,
    660,
    661,
    662,
    663,
    664,
    665,
    666,
    667,
    668,
    669,
    670,
    671,
    672,
    673,
    674,
    678,
    679,
    680,
    681,
    682,
    683,
    684,
    685,
    686,
    687,
    688,
    689,
    690,
    691,
    692,
    693,
    694,
    695,
    696,
    697,
    698,
    699,
    700,
    701,
    702,
    703,
    704,
    705,
    706,
    707,
    708,
    709,
    710,
    711,
    712,
    713,
    714,
    715,
    716,
    719,
    720,
    721,
    722,
    723,
    724,
    725,
    726,
    727,
    728,
    729,
    730,
    731,
    732,
    733,
    734,
    735,
    736,
    737,
    738,
    739,
    740,
    741,
    742,
    744,
    745,
    747,
    752,
    753,
    754,
    755,
    756,
    757,
    758,
    759,
    762,
    763,
    764,
    765,
    766,
    767,
    768,
    769,
    770,
    771,
    772,
    773,
    774,
    775,
    807,
    808,
    809,
    810,
    811,
    812,
    813,
    814,
    815,
    816,
    817,
    818,
    819,
    820,
    821,
    822,
    823,
    824,
    825,
    826,
    827,
    828,
    829,
    830,
    831,
    832,
    833,
    841,
    842,
    843,
    844,
    845,
    846,
    847,
    848,
    850,
    853,
    854,
    855,
    856,
    857,
    859,
    861,
    862,
    863,
    867,
    868,
    869,
    870,
    871,
    872,
    873,
    874,
    877,
    878,
    880,
    881,
    882,
    883,
    884,
    885,
    886,
    887,
    888,
    889,
    890,
    891,
    893,
    894,
    895,
    896,
    899,
    900,
    901,
    902,
    903,
    904,
    905,
    906,
    907,
    908,
    909,
    910,
    911,
    914,
    915,
    916,
    917,
    918,
    919,
    920,
    921,
    923,
    924,
    925,
    926,
    927,
    928,
    929,
    930,
    931,
    932,
    933,
    934,
    935,
    936,
    937,
    938,
    939,
    940,
    941,
    942,
    943,
    944,
    945,
    946,
    947,
    948,
    949,
    950,
    951,
    952,
    953,
    954,
    955,
    956,
    957,
    958,
    959,
    960,
    961,
    964,
    965,
    966,
    967,
    968,
    969,
    970,
    971,
    972,
    973,
    974,
    975,
    976,
    977,
    980,
    981,
    982,
    983,
    984,
    985,
    986,
    987,
    988,
    989,
    990,
    991,
    992,
    997,
    998,
    999,
    1000,
    1001,
    1002,
    1003,
    1004,
    1005,
    1006,
    1007,
    1009,
    1010,
    1011,
    1012,
    1013,
    1014,
    1015,
    1016,
    1017,
    1018,
    1019,
    1020,
    1021,
    1022,
    1024,
    1025,
    1026,
    1027,
    1028,
    1029,
    1030,
    1031,
    1032,
    1033,
    1034,
    1035,
    1036,
    1037,
    1038,
    1039,
    1040,
    1041,
    1042,
    1043,
    1044,
    1045,
    1046,
    1047,
    1048,
    1049,
    1050,
    1051,
    1052,
    1053,
    1054,
    1055,
    1056,
    1057,
    1058,
    1059,
    1060,
    1061,
    1062,
    1063,
    1064,
    1065,
    1066,
    1067,
    1068,
    1069,
    1070,
    1071,
    1075,
    1076,
    1077,
    1078,
    1079,
    1080,
    1081,
    1082,
    1083,
    1084,
    1085,
    1086,
    1087,
    1088,
    1089,
    1090,
    1091,
    1092,
    1093,
    1094,
    1095,
    1096,
    1097,
    1098,
    1099,
    1100,
    1101,
    1102,
    1103,
    1104,
    1105,
    1106,
    1107,
    1108,
    1109,
    1110,
    1111,
    1112,
    1113,
    1114,
    1115,
    1116,
    1117,
    1118,
    1120,
    1122,
    1123,
    1124,
    1125,
    1126,
    1127,
    1132,
    1133,
    1134,
    1135,
    1136,
    1137,
    1138,
    1139,
    1140,
    1141,
    1142,
    1143,
    1144,
    1145,
    1146,
    1147,
    1148,
    1149,
    1150,
    1151,
    1152,
    1153,
    1154,
    1155,
    1156,
    1157,
    1158,
    1159,
    1160,
    1161,
    1162,
    1163,
    1164,
    1165,
    1166,
    1167,
    1168,
    1169,
    1170,
    1171,
    1172,
    1173,
    1174,
    1175,
    1176,
    1177,
    1178,
    1179,
    1180,
    1181,
    1182,
    1183,
    1184,
    1185,
    1186,
    1187,
    1188,
    1189,
    1190,
    1191,
    1192,
    1193,
    1194,
    1195,
    1196,
    1197,
    1198,
    1199,
    1200,
    1201,
    1202,
    1203,
    1204,
    1205,
    1206,
    1207,
    1208,
    1209,
    1210,
    1220,
    1221,
    1222,
    1223,
    1224,
    1225,
    1226,
    1227,
    1228,
    1229,
    1230,
    1231,
    1232,
    1233,
    1234,
    1235,
    1236,
    1237,
    1238,
    1239,
    1240,
    1241,
    1242,
    1243,
    1244,
    1245,
    1246,
    1247,
    1248,
    1249,
    1250,
    1251,
    1252,
    1253,
    1254,
    1255,
    1256,
    1257,
    1258,
    1259,
    1260,
    1261,
    1262,
    1263,
    1264,
    1265,
    1266,
    1267,
    1268,
    1269,
    1270,
    1271,
    1272,
    1273,